{
  "schema_version": "ats.text_ir.v1",
  "artifact_id": "fixture-basis-002-authorized-change",
  "source": {
    "content_sha256": "73ed85a6ed9e597a4dec681271fc747cbcdb7e49e78dfaecf85dfd8b1921d625",
    "normalized_sha256": "73ed85a6ed9e597a4dec681271fc747cbcdb7e49e78dfaecf85dfd8b1921d625",
    "media_type": "text/plain",
    "locator": "fixtures/ir/sources/fixture-basis-002-authorized-change.txt"
  },
  "policy_snapshot_id": "policy-fixture-draft2",
  "language": "en",
  "audience": {
    "audience_id": "draft2-fixture-audience",
    "expertise": "expert"
  },
  "sections": [
    {
      "section_id": "s1",
      "heading": "fixture-basis-002-authorized-change",
      "profiles": [
        "TRANSFORM"
      ],
      "claims": [
        {
          "claim_id": "OUT-B2-4",
          "role": "judgment",
          "proposition": "The acceptance kernel rejects stale-policy transitions at 55-80%: the source declared this band explicitly.",
          "material": true,
          "polarity": "positive",
          "status": "asserted",
          "semantic_basis": {
            "basis": "EXPLICIT",
            "rationale": "The output presents the band as stated by the source."
          },
          "source_refs": [
            "EV-B2-4"
          ],
          "extensions": {
            "source_basis": {
              "EV-B2-4": "INFERRED"
            }
          }
        }
      ],
      "evidence": [
        {
          "evidence_id": "EV-B2-4",
          "proposition": "Audit entries show rejections clustering around stale-policy transitions.",
          "source": {
            "source_id": "src-EV-B2-4",
            "source_type": "synthetic_fixture",
            "availability": "present",
            "locator": "fixtures/ir/sources/EV-B2-4.txt"
          },
          "availability": "present"
        }
      ],
      "relations": [],
      "update_indicators": []
    }
  ],
  "extraction_status": "complete",
  "extensions": {
    "authorized_change": {
      "change_id": "CHG-DRAFT2-004",
      "rule_id": "ATS-BASIS-002",
      "promoted_axis": "authority",
      "from_basis": "INFERRED",
      "to_basis": "EXPLICIT",
      "authority": "draft2-fixture-change-authority",
      "authorization_ref": "CHG-DRAFT2-004",
      "rationale": "The new-authoring change explicitly declares precedence for the stale-policy rejection band under granted authoring authority."
    }
  }
}
